{
  "system_id": "my-system",
  "ands_version": "1.0",
  "declared_ands": "3.2.1.1.4",
  "certification_level": "SELF",
  "capabilities": {
    "tool_use": true,
    "memory_persistence": false,
    "autonomous_execution": false,
    "state_mutation": true,
    "code_execution": false
  },
  "attestation_urls": [
    "https://example.com/attest"
  ],
  "contact": "contact@example.com",
  "signed": {
    "alg": "ed25519",
    "sig": "+hMRDgLvXU1wpmzMKQZfCKWPOYKQUsZfdYP22sEpiBDmsGmdid+JPVeyo1FBEPClvApg83SiPkVXRvpRXu9OCQ==",
    "pubkey": "kEArsCV4YS4D0ZCFPBTczziY/pT2RPPgK/nwBqVVEaI="
  }
}